Topic,Count,Name,Representation,Representative_Docs
-1,330,-1_absolutely_crown_thank_yeah,"['absolutely', 'crown', 'thank', 'yeah', 'google', 'android', 'thank thank', 'wow', 'music', 'yeah yeah']","['In addition, wireless Android Auto compatibility makes it easy to stay connected to Android devices and access various apps and services from Google, including YouTube Music and Google Maps.', 'In addition, wireless Android Auto compatibility makes it easy to stay connected to Android devices and access various apps and services from Google, including YouTube Music and Google Maps.', 'In addition, wireless Android Auto compatibility makes it easy to stay connected to Android devices and access various apps and services from Google, including YouTube Music and Google Maps.']"
0,30823,0_model_brand_car_new,"['model', 'brand', 'car', 'new', 'like', 'just', 'vehicle', 'electric', 'design', 'drive']","['Let me prove it to you by introducing the all-new Brand Model.', ""The Model marks a new chapter for the brand and is certainly one of Brand 's most anticipated new vehicles."", ""Brand was one of the pioneers in automotive driving when we launched the world's first direct adaptive steering, or steer-by-wire system, for the new Model in 2013.""]"
1,135,1_warranty_000_mile_year,"['warranty', '000', 'mile', 'year', 'whichever', 'whichever comes', 'maintenance', '000 miles', '100 000', 'years']","['Plus, Model includes a hybrid system warranty for eight years or 100,000 miles, whichever comes first, and a 10-year or 150,000-mile hybrid battery warranty, whichever comes first, making it a strong choice for long-term ownership.', 'Best of all, it also comes with incredible value, since all grades come with ToyotaCare, which provides two years or 25,000 miles of scheduled maintenance, whichever comes first, and three years unlimited mileage of 24-hour roadside assistance, an 8-year or 100,000-mile hybrid system warranty, whichever comes first, and a 10-year or 150,000-mile hybrid battery warranty, whichever comes first.', 'Plus, every Model comes with ToyotaCare, which provides two years or 25,000 miles of scheduled maintenance, whichever comes first, and three-year unlimited mileage of 24-hour roadside assistance, an 8-year or 100,000-mile hybrid system warranty, whichever comes first, and a 10-year or 150,000-mile hybrid battery warranty, whichever comes first, all of which further strengthen its value.']"
2,111,2_thank thank_thank_thank thanks_thanks,"['thank thank', 'thank', 'thank thanks', 'thanks', 'thanks thanks', 'irv', '', '', '', '']","['Thank you.', 'Thank you.', 'Thank you.']"
3,104,3_okay_okay okay_yes_right,"['okay', 'okay okay', 'yes', 'right', 'right okay', 'okay right', 'yes yes', 'right right', 'yes right', 'yep']","['Okay.', 'Okay.', 'Okay.']"
