Topic,Count,Name,Representation,Representative_Docs
-1,458,-1_polestar_clarity_accord_elantra,"['polestar', 'clarity', 'accord', 'elantra', 'prius', 'car', 'honda', 'brand']","['Today we introduce the Honda Clarity line. We have a fuel cell powered Clarity, a pure battery electric Clarity, and a plug-in hybrid.', 'The Clarity fuel cell, Clarity electric, and Clarity plug-in hybrid. Today, there are a lot of claims in this space, but no automaker knows more about customers of electrified vehicles than Honda.', 'The Clarity Fuel Cell, Clarity Electric, and Clarity Plug-in Hybrid. Today, there are a lot of claims in this space, but no automaker knows more about customers of electrified vehicles than Honda.']"
0,6972,0_car_new,"['car', 'new']","['It also happens to be electric. The new Leaf is the future of Nissan.', ""We'll have to make a new one soon because there's more to come."", 'Now our engine is mated with an all-new nine-speed dual-clutch transmission of our own design, which houses a electric motor at the rear, directly driving the rear wheels.']"
1,224,1_hyundai_sonata_ioniq_kia,"['hyundai', 'sonata', 'ioniq', 'kia', 'new', '2018', 'fleet', 'optima', 'vehicle']","[""It's a lot more fun to drive and it was just a great experience all around. The 2018 Hyundai Sonata, our best Sonata ever."", 'How can you beat that? The 2018 Hyundai Sonata, our best Sonata ever.', ""I had a really great time, and I can't wait to jump behind the wheel of one of these vehicles, hopefully very soon. The 2018 Hyundai Sonata, our best Sonata ever.""]"
2,200,2_bmw_series_i8_new,"['bmw', 'series', 'i8', 'new', 'car', 'i3', 'driving', 'design', 'x6']","['Very impressive is also the way to interact with the all-new BMW 7 Series.', 'Just think of BMW i or BMW M. Now carbon fiber comes to the all-new BMW 7 Series.', ""Introducing the all-new BMW 7 Series, the flagship of BMW. It embodies everything BMW stands for and features a great deal of innovations you've never seen before.""]"
3,174,3_infiniti_q50_infinity_brand,"['infiniti', 'q50', 'infinity', 'brand', 'performance', 'cancer', 'johan', 'market']","[""The Q50 is the latest premium performance sedan from Infiniti. The Q50 is longer, lower, and wider than Infiniti's previous G37 sedan, and it has world's first advances for the luxury market."", ""Hello, I'm Jane, a product specialist for Infiniti, and this is the all-new Infiniti Q50."", 'So ladies and gentlemen, please welcome the new Infiniti Q50. Here it is, the new Infiniti Q50.']"
4,165,4_volvo_new_xc90_xc40,"['volvo', 'new', 'xc90', 'xc40', 'design', 'safety', 'cars', 's90']","[""New intelligence, a new beginning. The all-new XC90 drives Volvo's impeccable speed."", 'The all-new XC90. A new design, a new beginning. The all-new XC90.', 'The all-new XC90. A new design, a new beginning. The all-new XC90.']"
