Topic,Count,Name,Representation,Representative_Docs
-1,3515,-1_brand_car_new_drive,"['brand', 'car', 'new', 'drive', 'design', 'vehicle', 'performance', 'look']","[""With Brand Motors Europe as our Virtual Fleet Lounge partner, we present today the all-new Brand Model range. And our guest is Mr. Mark Howlett, Fleet Sales Manager, Brand Motors Europe. He will explain why Brand can be a perfect choice for your corporate fleet program by presenting the all-new Brand Model range, composed among others of the Brand Model Sport Wagon and the Model PH EV, Brand 's first plug-in hybrid model."", 'The new Brand Model represents technological Brand, or Brand of Technology, which is a traditional term associated with Brand in Japanese language, and this is definitely a great opportunity of which we intend to make the most. While the current Brand Model was the EV pioneer, the new Brand Model has the real potential to become the core of the company. The new Brand Model will drive the Brand Intelligent Mobility forward.', ""Plus, there's a standard three-month SiriusXM PlatinumPlan trial subscription that includes over 165 channels available in-cabin and even more on the SXM mobile app, making it easier than ever to enjoy not just ad-free music, but also sports, comedy, and more. All grades also come with trials to Brand 's line of connected services, including Safety Connect, Service Connect, Remote Connect, Wi-Fi Connect, and Drive Connect.""]"
0,886,0_brand_model_car_new,"['brand', 'model', 'car', 'new', 'design', 'customers', 'best', 'sedan']","['The new Brand Model is the next step in transforming the Brand brand into what many of us at General Motors over the last 10 years have hoped that we could make the Brand brand be. Are we going to unveil this car together? We are.', ""The new Brand Model isn't just another car, it's a better car. And to show you how, we've invited a Brand Model owner to come and take it for a test drive to see for herself how the new Model makes every mile better."", 'There was huge interest when the all-new Brand Model was unveiled to the world press. This car is the start signal for a new era for Brand cars and the Brand brand, where design, technology, environmental performance and safety are at a new, higher level. Brand is well known to everybody, but now they see Brand developing in direction, bringing in high-tech, very advanced solutions and technology, really to strengthen our brand.']"
1,833,1_hybrid_engine_model_horsepower,"['hybrid', 'engine', 'model', 'horsepower', 'electric', 'battery', 'torque', 'range', 'motor']","[""Set for a spring 2009 release, the 2010 Brand Model Hybrid hopes to answer the fuel-efficient gauntlet thrown down by Brand. The Model is Brand 's response to the Brand Model, and like the Model, is expected to receive over 40 miles per gallon for both city and highway driving. The Model uses a complete gas-electric hybrid system and features a 1.3-liter, 98-horsepower, 4-cylinder engine paired to an electric motor."", ""A spirited 2.0-liter, 147-horsepower, 4-cylinder comes standard under the hood. If you're looking for better fuel economy that doesn't come at the expense of power, there's an available EcoTrim with a 1.4-liter turbo GDI engine with 7-speed dual-clutch transmission that delivers 128 horsepower and up to an EPA-estimated 40 miles per gallon highway."", 'The hybrid Model features a 1.6-liter GDI Atkinson cycle 4-cylinder engine coupled with a permanent magnet electric motor powered by a lithium-ion polymer battery located under the rear seats. Together, the motor and engine deliver plenty of power and torque for spirited performance. The high-efficiency electric motor has a pure electric driving mode that delivers instant torque at lower speed and power-assisted acceleration at higher speeds.']"
2,565,2_audio_available_carplay_wireless,"['audio', 'available', 'carplay', 'wireless', 'touchscreen', 'smartphone', 'standard', 'key']","['Every grade comes with the latest Brand Audio Multimedia platform with an 8-inch touchscreen on SE or a 10.5-inch touchscreen on XSE. Both versions include standard wireless compatibility for Apple CarPlay, which connects drivers to the apps on their iPhone, including maps, messages, podcasts, and music subscriptions. In addition, wireless Android Auto compatibility makes it easy to stay connected to Android devices and access various apps and services from Google, including YouTube Music and Google Maps.', 'Brand Model features the newest technologies from Brand. Every grade comes standard with the latest Brand Audio Multimedia platform with a 12.3-inch touchscreen, and includes standard wireless compatibility for Apple CarPlay, which connects drivers to the apps on their iPhone, including maps, messages, podcasts, and music subscriptions. In addition, wireless Android Auto compatibility makes it easy to stay connected to Android devices and access various apps and services from Google, including YouTube Music and Google Maps.', ""That's complemented by the latest Brand Audio Multimedia interface, which has a standard 8-inch touchscreen or an available 12.3-inch touchscreen. In either case, the latest system includes standard wireless compatibility for Apple CarPlay, which connects drivers to the apps on their iPhone, including maps, messages, podcasts, and music subscriptions. In addition, wireless Android Auto compatibility makes it easy to stay connected to Android devices and access various apps and services from Google, including YouTube Music and Google Maps.""]"
3,551,3_rear_grille_design_car,"['rear', 'grille', 'design', 'car', 'light', 'model', 'look', 'headlights', 'new']","[""Elements like that elongated, wide, sporty front grille, that elegant swooping hood, and those stunning full LED headlights that include daytime running lights that I love. This seamlessly integrates into the main vehicle body. Now, speaking of that vehicle body, you're gonna notice aggressive curves and sleek lines that embody that sport coupe design influence."", ""Up front, you see the LED headlights and LED daytime running lights that create a futuristic yet retro look and are a signature part of Model 's brand design. You can also see this design in way more than just the headlights as we take a look at the side mirrors and the outer door handles."", 'The roof pillars are slimmer and the headlights more streamlined, and the available LED headlamps and daytime running lights combine with a signature grille design to emphasize the front-end width and the very low hood. Similar to the show cars from the last few years, the V-Motion grille is dominant and sets up the big rearward movement of the design itself, drawing your eyes from this wonderful hood through the cabin and off the rear of the car.']"
4,541,4_electric_brand_model_vehicles,"['electric', 'brand', 'model', 'vehicles', 'new', 'vehicle', 'car', 'cars', 'future']","['And that is why the Brand Motor Group has invested significantly in advancing electrification throughout its lineup. You have already seen our commitment to electrification in our newest model hybrids, plug-in hybrids, and battery electric vehicles, as well as fuel cell powertrains. The market response to our efforts has been great.', 'Today, there are a lot of claims in this space, but no automaker knows more about customers of electrified vehicles than Brand. Our first dedicated electric car came to the market two decades ago. Our first fuel cell vehicle more than 15 years ago.', 'So everything started with three hybrids and when did the idea of a full electric Brand come alive? The next step was for us to use that experience and we built up a demonstrator. It was a Boxster E, so an all-electric car.']"
5,520,5_assist_safety_lane_parking,"['assist', 'safety', 'lane', 'parking', 'spot', 'alert', 'collision', 'blind', 'traffic']","[""To that end, the latest Brand Safety Sense 3.0 Suite offers great peace of mind and confidence through features like a Pre-Collision System, Lane Departure Alert, Automatic High Beams, Full-Speed Range Dynamic Radar Cruise Control, Lane Tracing Assist, and Road Sign Assist. There's also standard Blind Spot Monitor with Rear Cross-Traffic Alert, as well as an available Bird's Eye View Camera with Perimeter Scan, and available Front and Rear Parking Assist with Automated Braking."", 'Every grade comes standard with Brand Safety Sense 2.5+, which includes Pre-Collision System with Pedestrian Detection, Lane Departure Alert with Steering Assist, Automatic High Beams, Full-Speed Range Dynamic Radar Cruise Control, Lane Tracing Assist, and Road Sign Assist. On top of that, Blind Spot Monitor with Rear Cross-Traffic Alert is also standard in both grades.', 'Model brings peace of mind thanks to the standard Brand Safety Sense 3.0, a standard system of active safety and driver assistance features that includes pre-collision system with pedestrian detection, Lane Departure Alert with Steering Assist, Automatic High Beams, Full Speed Range Dynamic Radar Cruise Control, Lane Tracing Assist, Road Sign Assist, and Proactive Driving Assist. Additionally, the standard Blind Spot Monitor with Rear Cross-Traffic Alert provides an additional layer of assistance on the road.']"
6,410,6_charging_charge_stations_fast,"['charging', 'charge', 'stations', 'fast', 'level', 'charger', 'volt', 'model', 'plug', 'station']","['With a Level 2 charger, your Brand Model electric vehicle will charge to 80% in approximately 2 hours and 50 minutes, and your Brand plug-in hybrid will charge to 100% in approximately two and a half hours. DC fast charging, sometimes referred to as Level 3, delivers direct current, or DC, to the battery to drastically reduce charging time. In fact, DC fast charging makes it possible to reach an 80% charge in your Model in approximately 36 minutes.', 'There are several ways you can charge your Brand Model at home. Brand recommends Level 2 charging using the wall-mounted Brand i charging station designed to complement your Brand i-vehicle, which reduces charging time for the Brand Model to around three and a half hours. Now this station and other Level 2 home charging stations charge your Brand Model at 240 volts from the convenience of your own home.', ""There are several ways to charge your Brand Model 's high voltage battery, giving you a variety of convenient home and public charging options. Level 2 charging from a Level 2 home or public charging station, Level 1 charging from the occasional use cable, which comes with every Brand Model vehicle, or DC charging from a DC charging station. Let's take a closer look at each of these.""]"
7,393,7_filtered_topic_terms_unavailable,['filtered_topic_terms_unavailable'],"[""Well, hey, good evening. Welcome to, um... Fantasyland no welcome to a great a great opportunity for us to be together. I've been talking a little bit about RAV tonight."", ""Happy to be here. Well, thanks for joining us. We're really excited to be talking to you today."", ""I said, my God, we won't be doing that this afternoon. He said, I got the line a little bit wrong. He said, this afternoon, we're going to take it further to the right.""]"
8,340,8_seats_seat_space_rear,"['seats', 'seat', 'space', 'rear', 'heated', 'cargo', 'interior', 'comfort', 'model']","['After the seat reclines, the seat can be adjusted through the seat adjustment switch. The second row multi-stage latch function is applied to the rear seats. Pulling the lever on the rear seats moves the seat back slightly, allowing each passenger to adjust their seating posture.', 'Inside, Model strikes a perfect balance between convenience and comfort. This can be seen in a number of features, including an available dual-zone climate control system, rear seat AC vents that are now standard for 2022, a center console with spacious storage, 60-40 split folding and reclining rear seats, as well as available heated and ventilated front seats and heated outboard rear seats.', 'Model continues to strike the perfect balance between convenience and comfort for 2023, which can be seen in features like its available dual-zone climate control system, available heated and ventilated front seats, and heated outboard rear seats, a center console with spacious storage, AC vents for backseat occupants, and 60-40 split folding and reclining rear seats.']"
9,265,9_display_screen_information_navigation,"['display', 'screen', 'information', 'navigation', 'displays', 'functions', 'control', 'new', 'driver']","[""There are three distinct driver display modes: Calm, Navi, and Car Centric. Of course, essential driver information is shown in all modes, just like information about battery capacity and range. And the center display touchscreen is equally updated, with customizable tiles giving you even more intuitive and smoother control of the car's functions while driving."", 'When equipped with the available head-up display, touch sensors in the steering wheel display the controls in the head-up display so that I can easily operate features without looking at the steering wheel. It makes for intuitive operation that helps you concentrate on driving. Just as the cockpit area is built around the driver, the front passenger area is open and spacious.', 'You can pick different display modes using the left side of the steering wheel. And if you swipe up, so available with Pinnacle Trim is the Head-Up Display functions. Now our second screen, this is our 11.9-inch portrait-oriented center display.']"
10,229,10_steering_suspension_car_rear,"['steering', 'suspension', 'car', 'rear', 'control', 'model', 'ride']","['On curvy roads like these, boy, it just needs a bit of steering input to push the car through these bends. The rear axle steering perfectly complements the overall sportier tuning of the steering and the suspension. Combined, these give us perhaps the best stability and driving dynamics ever on a C-Class.', 'Adaptive, damper-controlled suspension is standard, and the available air suspension makes the Brand Model ready for any road. The available all-wheel steering system helps connect the driver to the road. Rear wheel steering can turn the rear wheels up to five degrees, decreasing turn radius, easing parking, and increasing agility at higher speeds.', 'So tell me about the rear wheel steering. How is this benefiting me around these curves? Yeah, so around these turns, the rear axle steering helps you get just a little bit more responsive turn in for the car.']"
11,182,11_driving_car_driver_road,"['driving', 'car', 'driver', 'road', 'little', 'best']","['And we use it with a 2.8-inch drive. And we use it with a 2.8-inch drive. And we use it with a 2.8-inch drive.', 'We use it with a 2.5-inch drive. And we also use it with a 2.3-inch drive. We use it with a 2.8-inch drive.', 'What is it? When do I get to drive it? How about right now?']"
12,166,12_black_model_hybrid_available,"['black', 'model', 'hybrid', 'available', 'standard']","[""Based on the SE grade, Model FX delivers a healthy dose of style to its spirited drive, featuring 18-inch satin black finished alloy wheels with machined accents, a black painted rear spoiler, exterior badging, black painted mirror caps, a midnight black metallic shark fin antenna, smoked LED taillights with black accents, black lug nuts, and available two-tone exterior colors with a midnight black metallic roof. This dynamic compact just can't be ignored."", 'SE Nightshade delivers a sleek, custom look with its black trim, including accented door handles, mirror caps, antenna, rear spoiler, window trim, and black rear badging. And for 2023, new 19-inch TRD matte bronze-finished wheels help add even more style across all Nightshade models. Meanwhile, Model TRD declares its performance capabilities with 19-inch TRD matte black wheels and a gloss black aero kit, including a gloss black front splitter and raised black rear spoiler.', 'The all-new Hybrid Woodland Edition arrives for 2023 adorned with raised black roof rails and crossbars, mudguards, black accent batching, and distinct 18-inch bronze-colored TRD alloy wheels. Meanwhile, gas-powered Model XLE Premium and Limited models come standard with 19-inch Superchrome alloy wheels, while Adventure sports 19-inch matte grey alloy wheels, and TRT Offroad offers its own aggressive flair through matte black alloy wheels. Hybrid SE and XSE, on the other hand, feature 18-inch multi-spoke black sport alloy wheels.']"
13,163,13_president_brand_ladies_vice,"['president', 'brand', 'ladies', 'vice', 'chief']","['Please welcome Group Vice President and General Manager, Brand Division, Brand Motor North America, Jack Hollis. Sporting events in one day. They saw the Kings.', 'Ladies and gentlemen, the Senior Vice President and General Manager of the Brand Division, Mr. Mike Accovetti. Good morning. Hi, everyone.', 'Ladies and gentlemen, please welcome group vice president and general manager Brand division Jack Hollis. Well, good afternoon, everybody. How you doing?']"
14,154,14_interior_carbon_materials_fiber,"['interior', 'carbon', 'materials', 'fiber', 'material', 'leather', 'inside', 'design', 'new']","['So everything is aerodynamically efficient, of course weight savings in mind everywhere, ultra stiff while saving weight. So you have carbon fiber in the door panel, carbon fiber beams with aluminum panels. So the structure in the door is actually carbon.', ""It doesn't have that traditional weave everyone is familiar with when they think about carbon fiber. Because of a new manufacturing process, Brand has managed to actually reduce the cost of mass producing carbon fiber. And as an added interesting note, the carbon fiber material used in the Model is made in the USA at a facility which only uses hydropower."", ""And I said to myself, well, that would be a nice number. So, let's see. In the interior, no, not in the interior.""]"
15,143,15_model_brand_new_product,"['model', 'brand', 'new', 'product', 'ladies', 'look']","['So ladies and gentlemen, please welcome the new Brand Model. Here it is, the new Brand Model. The new Model carries all of the brand-defining design language of Brand.', 'My focus is my family. My focus is to help people. So here it is, the all-new Brand Model.', 'The Brand Model.']"
16,141,16_supercar_model_performance_racing,"['supercar', 'model', 'performance', 'racing', 'brand', 'new', 'car', 'driving', 'door']","[""We are up more than 50% with AMG sales year over year. So for anyone who thinks 50 is over the hill, the unprecedented demand for Brand -AMG cars and SUVs should prove them otherwise. But now, I'll let Mr. AMG himself tell you more about our performance brand."", 'The AMG of AMGs.', ""The Brand -AMG Model is a new vision for the future of high performance and embodies the motorsports heritage of AMG while delivering a rush of all-electric excitement. My name is Nick and I'm here to meet Brian to see the all-new Brand AMG Model. Hey Nick.""]"
17,133,17_pedal_mode_braking_brake,"['pedal', 'mode', 'braking', 'brake', 'sport', 'driving', 'accelerator', 'energy', 'drive', 'comfort']","['i-Pedal 3.0 allows you to speed up, slow down, or even come to a complete stop, all just using the accelerator pedal. It also captures energy that would normally be lost when braking, helping to maximize efficiency. And now, i-Pedal 3.0 works in reverse.', 'Press the accelerator pedal and you surge forward, experiencing the instantaneous torque that only the advanced electric drive powertrain of eDrive can deliver. E-Drive technology also has the advantage of one-pedal driving. Release the accelerator pedal and feel the instant braking effect of brake energy recuperation.', ""So can you use the regen on demand paddle while you're in one pedal driving mode? Yes, that's a great question. So a lot of times when I'm in traffic and I'm in one pedal driving mode and maybe a car in front of me starts to slow down a little bit more than I anticipated, I can reach up and grab the regen on demand paddle and get the maximum amount of regenerative braking available.""]"
18,96,18_sound_noise_quiet_acoustic,"['sound', 'noise', 'quiet', 'acoustic', 'car', 'wind', 'engine', 'silent', 'sounds', 'quietness']","[""Well, I'm just excited. That sound is amazing. What is it?"", ""There is both an audible noise outside the car as well as inside. And it's interesting. It's a noise that's meant to sound like an AMG while not trying to sound like an internal combustion engine."", ""Let's go. Don't say that. Sound, sound, sound.""]"
19,91,19_door_tailgate_open_release,"['door', 'tailgate', 'open', 'release', 'hood', 'place', 'trunk', 'cover']","['Next, remove the cover attached to the tailgate. Place your hands around the lower edge of the cover and pull to unclip. Then push it upwards to disengage and place the cover under the floor compartment.', 'For convenient and easy access to both front and rear, the Model doors are designed to open outward with no obstructions to the passenger compartment. To open the rear door, pull the handle here. Always close the rear door first.', ""Once at the hood, reach in and press the tab to release the locking mechanism and open the hood. The tailgate on the Model can be opened from both inside and outside the vehicle. To open the tailgate from inside, press the button in the driver's footwell.""]"
20,88,20_car_brand_proud_cars,"['car', 'brand', 'proud', 'cars', 'excited', 'super', 'new']","[""Look, I should be proud of the fact that Cinque Cento is an extraordinary product, I should be proud of the awards, but you know what I'm most proud of? Well, it's the fact that Brand is the only car brand that was picked by my friend Bono for red. Now I know, this room is familiar with causes, more than with cars, so I won't try to sell you the car, but rather the cause."", ""All of Brand Cars is very proud about this car. And before I can ask you to come forward, I'd just like to mention there's three more cars outside to take a look around in, along with many of my colleagues who'll be very happy to show you around."", ""All of Brand Cars is very proud about this car. And before I can ask you to come forward, I'd just like to mention there's three more cars outside to take a look around in, along with many of my colleagues who'll be very happy to show you around.""]"
21,88,21_auto_brand_season_new,"['auto', 'brand', 'season', 'new', 'excited', 'press', 'reveal']","[""But we're going to show you what the Auto Show looks like the day before the show. Let's take a look at that video. Hi, I'm Kristin Burt for Brand Motor America, and we're at the 2015 Los Angeles Auto Show in downtown LA."", 'This might be one of the biggest press conferences we have seen all year long. Remember we joined you guys in Los Angeles as well as Detroit and of course here for the final show of the season here in New York. This will wrap up the 2015-16 Auto Show season.', ""Good morning and welcome to the New York International Auto Show and Brand Live Connect. I'm Kristen Burke coming to you live from the Jacob Javits Center for the final big show of the 2015-16 Auto Show season. We are so excited to have you join us today because we have got a very big reveal with the Model.""]"
22,80,22_electric_price_vehicles_evolution,"['electric', 'price', 'vehicles', 'evolution', 'affordable', 'inventory', 'pricing']","['We have plants that create electric vehicles, electric vehicle parts, all-terrain vehicles, go-karts, electric balancing scooters, battery packs, and battery exchange systems. Candy Technologies Group has long been known for bringing exciting and affordable recreational and off-road vehicles to the US marketplace. After acquiring SC Autosports in 2018, we have been preparing to launch Candy brand electric vehicles in the US marketplace.', ""Now you know what we mean when we say Candy is the auto evolution for all. As you can see, Candy America is committed to offering the most affordable vehicles on the U.S. market, so anyone who wants to drive one can do so. Now, let's take a look at the model K23."", 'And once a $7,500 federal tax credit is applied, it is only $19,999 for eligible buyers. Talk about an auto evolution for all. Both the Candy Model and K23 models are under $20,000 for the first 2,000 pre-orders.']"
23,76,23_class_new_brand_luxury,"['class', 'new', 'brand', 'luxury', 'car', 'customers', 'best', 'modern', 'driving']","[""Although I can still show you what this new S-Class is capable of. This is the new S-Class. It's more than just a car."", 'Why is that so? Why is the Brand S-Class so special to you? For us at Brand, the Brand S-Class is hugely important.', 'Absolutely. First of all, the Brand S-Class. We have the all-new Brand S-Class here, and the Brand S-Class is the first model that comes to mind as a consumer when we speak of the brand of Brand.']"
24,71,24_brand_global_market_plant,"['brand', 'global', 'market', 'plant', 'world', 'new', 'largest']","[""Look, obviously, Brand is at this stage still a US-centric brand. This is by far our strongest market. But as we are now beginning to set up a global footprint, probably starting also with us locating our global headquarters in Hong Kong, the Chinese market today is the world's largest car market and certainly no car company could imagine to be a strong player in the world markets if you aren't also there with a strong presence in China."", 'Those who got in early, like us, have benefited more than others. Brand, Brand, Brand, Brand and Brand are other brands with greater sales in China than here in the US. As we do in the US, we sell regional products for China that cater to the local market dynamics.', ""Since Model was first launched in China, we've sold 2.6 million Model across the Asia-Pacific region, most of them here in China. It competes in the largest segment in China. Remember, China is the world's largest automotive market, so it's such an important vehicle for us.""]"
