Topic,Count,Name,Representation,Representative_Docs
-1,2894,-1_car_new_drive_infiniti,"['car', 'new', 'drive', 'infiniti', 'driving', 'vehicle', 'cars', 'performance', 'clarity', 'electric']","['And it starts right here today with this new Infiniti Q50. Not only is this new car the first to bear our new nomenclature, it is also the first to completely crystallize our future design, performance and technology direction.', 'Today we introduce the Honda Clarity line. We have a fuel cell powered Clarity, a pure battery electric Clarity, and a plug-in hybrid.', ""That makes it the most fuel-efficient, all-wheel drive hybrid in America. The new Prius with all-wheel drive E will be available this January, and with its new styling, outstanding cargo capacity, and of course, amazing fuel efficiency, this new Prius is a perfect example of Accio Toyota's pledge to make ever better cars.""]"
0,3894,0_car_new_electric_hybrid,"['car', 'new', 'electric', 'hybrid', 'vehicle', 'engine', 'audi', 'drive', 'design', 'power']","['So power to the front wheels comes from an electric motor with a two-speed transmission and power to the rear wheels is from a three-cylinder turbocharged gas motor made into an automatic six-speed transmission.', ""The new Hyundai Sonata isn't just another car, it's a better car."", 'Doing them right when the time is right. And the time is right for electric to go Audi.']"
1,824,1_president_auto_ladies_vice,"['president', 'auto', 'ladies', 'vice', 'vice president', 'new', 'safety', 'la', 'future', 'technology']","['Ladies and gentlemen, please welcome group vice president and general manager Toyota division Jack Hollis Well, good afternoon everybody.', 'Ladies and gentlemen, please welcome Group Vice President, General Manager of Lexus, Mark Templin.', 'Ladies and gentlemen, please welcome Thomas Ingenlatt, Senior Vice President Design. Good morning, ladies and gentlemen.']"
2,640,2_display_navigation_screen_voice,"['display', 'navigation', 'screen', 'voice', 'information', 'phone', 'button', 'control', 'available', 'select']","[""Through the multi-information display, the available navigation screen which is positioned back at the top of the dash to improve the driver's sight lines or through an optional heads-up display."", 'Most of the functions are controlled via the steering wheel, displayed in the digital driver display, or in the optional head-up display.', ""It's that cool folks. And of course it's loaded with technology, things like a huge, like TV screen size touch screen, embedded modem, of course Apple CarPlay and Android Auto, wireless charging of the phones, heads up display.""]"
3,535,3_interior_carbon_fiber_leather,"['interior', 'carbon', 'fiber', 'leather', 'carbon fiber', 'materials', 'design', 'panel', 'high', 'beautiful']","['So you have carbon fiber in the door panel, carbon fiber beams with aluminum panels.', 'Interior color combinations. The interior is made of leather upholsteries and decor of carbon fiber, walnut, birch, metal, and aluminum.', ""So, let's see. In the interior, no, not in the interior. You can see the interior when we're here.""]"
4,520,4_buick_customers_market_brand,"['buick', 'customers', 'market', 'brand', 'sales', 'products', 'model', 'product', 'new', 'china']","['And with Buick, they get it. So, how did Buick get to our current standing in the marketplace and with our customers?', 'These models amount to more than 700,000 sales a year, or half of our total Buick brand volume.', 'Thanks for being here, Bob. Well, thank you, Susan. The new Buick Regal is The next step in transforming the Buick brand into what many of us at General Motors over the last 10 years have hoped that we could make the Buick brand be.']"
5,344,5_lane_assist_blind_traffic,"['lane', 'assist', 'blind', 'traffic', 'braking', 'spot', 'blind spot', 'collision', 'brake', 'camera']","[""It's blind spot detection system with rear cross traffic alert. Yes. I'm going to give you that one."", 'Automatic emergency braking with pedestrian detection, main departure warning system. along with blind spot detection and rear cross-traffic alert are offered on the vehicle.', 'I like that. You also get advanced safety technology. It offers standard blind spot detection with rear cross traffic alert and available automatic emergency braking, lane keep assist, and rear parking assistance system.']"
6,225,6_seats_seat_cargo_space,"['seats', 'seat', 'cargo', 'space', 'rear', 'room', 'trunk', 'seating', 'passenger', 'comfortable']","[""Now, it's not just about having a back seat. It's about the ability to fold down the back seat and have some actual cargo space."", 'The cabin provides ample legroom, rear seat room, both for rear seat passengers as well as great headroom in the front for front seat passengers.', 'The rear seat offers room for three and split-folding seatbacks for added luggage space.']"
7,209,7_led_light_lights_grille,"['led', 'light', 'lights', 'grille', 'headlights', 'lighting', 'signature', 'shape', 'tail', 'design']","['Elements like that elongated wide sporty front grille, that elegant swooping hood and those stunning full LED headlights that include daytime running lights that I love this, seamlessly integrate into the main vehicle body.', 'We started with our hallmark LED lighting and leapt light years ahead to create these available HD matrix design LED headlights featuring high beam assist which can automatically shift from high beams to low beams when oncoming traffic is detected.', 'The roof pillars are slimmer and the headlights more streamlined, and the available LED headlamps and daytime running lights combine with a signature grille design to emphasize the front-end width and the very low hood.']"
8,182,8_design_explain_studio_art,"['design', 'explain', 'studio', 'art', 'designers', 'beautiful design', 'sketch', 'modern', 'look', 'engineering']","['We visited with both of them recently in our Waco design studio and asked them to share some perspectives on the new design.', ""There's so much to talk about. We have the best design. We have a very advanced design, led by Peter Schreier as a design team."", 'It is a beautiful design. Yes. John and Kate and his design team did an excellent job.']"
9,166,9_polestar_electric_car_electric car,"['polestar', 'electric', 'car', 'electric car', 'brand', 'car polestar', 'subscription', 'volvo', 'customer', 'battery']","['So the Polestar customers will also have access to what we call Polestar On Demand.', ""Polestar. So, this great awesome design became our Polestar 2, and we're going to show it to you in a minute."", 'Now, looking at the lineup of Polestar 1, Polestar 2 and Polestar 3, you get a very good idea of the scope of our brand.']"
10,146,10_tailgate_door_open_trunk,"['tailgate', 'door', 'open', 'trunk', 'release', 'hood', 'soft', 'unlock', 'lock', 'pull']","[""To open the tailgate from inside, press the button in the driver's footwell."", 'To open them, use this release towards the top of the door frame.', ""So we're gonna unlock the car, open the door, open the trunk, open the fuel door.""]"
11,133,11_charging_charge_vehicle_charger,"['charging', 'charge', 'vehicle', 'charger', 'light', 'cable', 'plug', 'setting', 'socket', 'charged']","['If the circuit breaker for the charger or the occasional use cable is tripping as a As a result of the car charging, this setting allows you to lower the charging speed.', ""Don't start or move the vehicle while it's charging. When the charge level display in the car, and often on the charger too, shows 100%, the battery is fully charged."", 'Voila! Once open, remove the charging port cap. The top socket is for level 2 or level 1 charging and for i3 vehicles that are equipped with a DC fast charging or SAE the lower port is for DC charging.']"
12,124,12_hour_seconds_meters_range,"['hour', 'seconds', 'meters', 'range', '100', 'speed', 'kilometers', '60', 'kilometers hour', 'liters']","[""It'll be the fastest to 100 miles an hour. 4.2 seconds to 100 miles an hour."", ""We're going to talk about things beyond base maybe next year sometime this is the base model base model will do 0 to 60 in 1.9 seconds okay it'll that is the fastest this will be the first time that any car has broken two seconds at 0 to 60 it'll be the fastest to 100 miles an hour 4.2 seconds to 100 miles an hour faster than that jet over there um it'll do the quarter mile"", 'And even the base Model 3 will do 0 to 60 miles an hour or 0 to 100 kilometers an hour in less than six seconds.']"
13,116,13_leaf_nissan_nissan leaf_new nissan,"['leaf', 'nissan', 'nissan leaf', 'new nissan', 'ev', 'new', 'propilot', 'driving', 'nissan intelligent', 'intelligent']","['This is Two times longer than the first generation Nissan LEAF. The new Nissan LEAF will certainly be accepted by a wider range of customers.', 'ProPILOT and ePEDAL in the new Nissan Leaf are great examples of Nissan Intelligent Driving.', 'While the current Nissan LEAF was the EV pioneer, the new Nissan LEAF has the real potential to become the core of the company.']"
14,108,14_bmw_i3_bmw i3_charging,"['bmw', 'i3', 'bmw i3', 'charging', 'using', 'app', 'station', 'iremote', 'iremote app', 'charging station']","['The BMW iRemote app allows you to control and monitor your BMW iVehicle using your smartphone.', 'The BMW iRemote app allows you to control and monitor your BMW iVehicle using your smartphone.', 'BMW recommends Level 2 charging using the wall-mounted BMW i-charging station designed to complement your BMW i-vehicle, which reduces charging time for the BMW i3 to around three and a half hours.']"
15,100,15_seat_airbags_cargo_storage,"['seat', 'airbags', 'cargo', 'storage', 'center', 'rear', 'cover', 'console', 'airbag', 'center console']","['finally push the cover upwards until it is clipped in position. The rear seat backrests of the 3 Series Gran Turismo can be adjusted forward to boost cargo capacity or backwards to increase passenger comfort.', 'And then underneath, the center console right here. Alright, also down here in the storage area for the center console.', ""There are also storage nets located on the front seat backrests. In the cargo area, you'll find a holding strap mounted to both the left and right walls.""]"
